"oak - hard mode","oak - modo dificil"
"\PN, the Magic Boots will let you walk <b>anywhere</b> by pressing the CTRL key.","\PN, las Botas Mágicas te permitirán caminar a cualquier parte al presionar la tecla CTRL."
"They're a proof that you've completely and thoroughly beat the game!","¡Son una prueba de que has completado el juego por completo!"
"So you have collected the Bronze, Silver and Gold emblems.","Así que has reunido los emblemas de Bronce, Plata y Oro."
"\PN, you have fought remarkably hard to get where you are now.","\PN, has luchado increíblemente duro para llegar hasta aquí."
"And so, I would like to hand you these.","Y por eso, me gustaría darte esto."
"These will let you walk <b>anywhere</b> as long as you press the CTRL key.","Estas te permitirán caminar a cualquier parte mientras mantengas presionada la tecla CTRL."
"\PN! Wear Dem's Badge before challenging the Elite Four, Gym Leader rematches, or Mt. Silver.","¡\PN! Usa la Medalla de Dem antes de desafiar al Alto Mando, los reencuentros con Líderes de Gimnasio o el Mt. Plateado."
"If you win, you will receive a special emblem.","Si ganas, recibirás un emblema especial."
"Collect all three of them and I will have a special reward to give you.","Reúne los tres y te daré una recompensa especial."